{
  "source_id": "SOURCE-NABP-MPJE-SAMPLES",
  "source_class": "PUBLIC_OFFICIAL",
  "title": "MPJE Sample Questions",
  "publisher": "National Association of Boards of Pharmacy",
  "url": "https://nabp.pharmacy/wp-content/uploads/2020/07/MPJE-Sample-Questions.pdf",
  "access_type": "PUBLIC",
  "authority_level": "OFFICIAL_INFORMATIONAL",
  "permission_status": "VERIFIED",
  "legal_authority_allowed": false,
  "question_text_storage_allowed": false,
  "ai_processing_allowed": true,
  "public_repo_allowed": true,
  "notes": "May inform item-type and high-level style characteristics. Do not copy or lightly paraphrase sample wording.",
  "last_reviewed": "2026-08-13"
}
